{
  "Parameters": {
    "TempLocation": {
      "Type": "string",
      "Description": "Alternative location to save downloads. If left on the default $Env:Temp will be used.",
      "DefaultValue": "SIF-Default",
      "Validate": "[TestPath(variable('Temp.Location'))]"
    },
    "NodeJSDownload": {
      "Type": "string",
      "Description": "Download location of NodeJS.",
      "DefaultValue": "https://nodejs.org/dist/v10.16.0/node-v10.16.0-x86.msi"
    },
    "NodeJS64Download": {
      "Type": "string",
      "Description": "Download location of NodeJS.",
      "DefaultValue": "https://nodejs.org/dist/v10.16.0/node-v10.16.0-x64.msi"
    }
  },
  "Variables": {
    "Check.Is64": "[Eval('[System.Environment]::Is64BitOperatingSystem')]",
    "Check.NodeJS": "[ValidateNotNull(GetPackage(Name:variable('DisplayName.NodeJS'),ErrorAction:'Continue'))]",

    "DisplayName.NodeJS": "Node.js",

    "NodeJS.SourceUri": "[if(variable('Check.Is64'),parameter('NodeJS64Download'),parameter('NodeJSDownload'))]",
    "NodeJS.Download": "[JoinPath(variable('Temp.Location'),'nodejs.msi')]",

    "Temp.Location" : "[if(variable('Test.Temp.Location'),Environment('Temp'),parameter('TempLocation'))]",

    "Test.Temp.Location" : "[equal(parameter('TempLocation'),'SIF-Default')]"
  },
  "Register": {
    "ConfigFunction": {
      "Eval": "Invoke-Expression",
      "GetPackage": "Get-Package",
      "TestPath": "Test-Path"
    },
    "Tasks": {
      "RemoveItem": "Remove-Item",
      "StartProcess": "Start-Process",
      "UninstallPackage": "Uninstall-Package"
    }
  },
  "Tasks": {
    "SetupTempLocation": {
      "Type": "EnsurePath",
      "Params": {
        "Exists": ["[variable('Temp.Location')]"]
      }
    },

    "DownloadNodeJS": {
      "Type": "DownloadFile",
      "Params": {
        "SourceUri": "[variable('NodeJS.SourceUri')]",
        "DestinationPath": "[variable('NodeJS.Download')]"
      },
      "Skip": "[or(variable('Check.NodeJS'),TestPath(variable('NodeJS.Download')))]"
    },
    "InstallNodeJS": {
      "Type": "StartProcess",
      "Params": {
        "FilePath": "msiexec.exe",
        "ArgumentList": [
          "/i", "[variable('NodeJS.Download')]",
          "/quiet", "/norestart"
        ],
        "Wait": true
      },
      "Skip": "[variable('Check.NodeJS')]"
    },
    "UpdateNpm": {
      "Type": "StartProcess",
      "Params": {
        "FilePath": "npm.exe",
        "ArgumentList": ["install", "-g", "npm"],
        "Wait": true
      }
    },
    "CleanArtifacts": {
      "Type": "RemoveItem",
      "Params": {
        "LiteralPath": [
          "[variable('NodeJS.Download')]"
        ],
        "Recurse": true,
        "ErrorAction": "SilentlyContinue"
      }
    }
  }
}