{
  "Parameters": {
    "TempLocation": {
      "Type": "string",
      "Description": "Alternative location to save downloads. If left on the default $Env:Temp will be used.",
      "DefaultValue": "SIF-Default",
      "Validate": "[TestPath(variable('Temp.Location'))]"
    },
    "DotNetHostingDownload": {
      "Type": "string",
      "Description": "Download location for .NET Core Runtime & Hosting Bundle",
      "DefaultValue": "https://download.visualstudio.microsoft.com/download/pr/eebd54bc-c3a2-4580-bb29-b35c1c5ffa92/22ffe5649861167d3d5728d3cb4b10a1/dotnet-hosting-2.1.12-win.exe"
    }
  },
  "Variables": {
    "Check.DotNetHosting": "[ValidateNotNull(GetPackage(Name:variable('DisplayName.DotNetHosting'),ErrorAction:'Continue'))]",

    "DisplayName.DotNetHosting": "Microsoft .NET Core 2.1.12 - Windows Server Hosting",

    "DotNetHosting.SourceUri": "[parameter('DotNetHostingDownload')]",
    "DotNetHosting.Download": "[JoinPath(variable('Temp.Location'),'dotnet-hosting-2.1.12-win.exe')]",

    "Temp.Location" : "[if(variable('Test.Temp.Location'),Environment('Temp'),parameter('TempLocation'))]",

    "Test.Temp.Location" : "[equal(parameter('TempLocation'),'SIF-Default')]"
  },
  "Register": {
    "ConfigFunction": {
      "Eval": "Invoke-Expression",
      "GetPackage": "Get-Package",
      "TestPath": "Test-Path"
    },
    "Tasks": {
      "RemoveItem": "Remove-Item",
      "StartProcess": "Start-Process",
      "UninstallPackage": "Uninstall-Package"
    }
  },
  "Tasks": {
    "SetupTempLocation": {
      "Type": "EnsurePath",
      "Params": {
        "Exists": ["[variable('Temp.Location')]"]
      }
    },

    "DownloadDotNetHosting": {
      "Type": "DownloadFile",
      "Params": {
        "SourceUri": "[variable('DotNetHosting.SourceUri')]",
        "DestinationPath": "[variable('DotNetHosting.Download')]"
      },
      "Skip": "[or(variable('Check.DotNetHosting'),TestPath(variable('DotNetHosting.Download')))]"
    },
    "InstallDotNetHosting": {
      "Type": "StartProcess",
      "Params": {
        "FilePath": "[variable('DotNetHosting.Download')]",
        "ArgumentList": ["/install", "/quiet"],
        "Wait": true
      },
      "Skip": "[variable('Check.DotNetHosting')]"
    },
    "CleanArtifacts": {
      "Type": "RemoveItem",
      "Params": {
        "LiteralPath": [
          "[variable('DotNetHosting.Download')]"
        ],
        "Recurse": true,
        "ErrorAction": "SilentlyContinue"
      }
    }
  }
}