{
  "Parameters": {
    "TempLocation": {
      "Type": "string",
      "Description": "Alternative location to save downloads. If left on the default $Env:Temp will be used.",
      "DefaultValue": "SIF-Default",
      "Validate": "[TestPath(variable('Temp.Location'))]"
    },
    "WebDeployDownload": {
      "Type": "string",
      "Description": "Download location for Web Deploy Module (x86)",
      "DefaultValue": "http://download.microsoft.com/download/0/1/D/01DC28EA-638C-4A22-A57B-4CEF97755C6C/WebDeploy_x86_en-US.msi"
    },
    "WebDeploy64Download": {
      "Type": "string",
      "Description": "Download location for Web Deploy Module (x64)",
      "DefaultValue": "http://download.microsoft.com/download/0/1/D/01DC28EA-638C-4A22-A57B-4CEF97755C6C/WebDeploy_amd64_en-US.msi"
    }
  },
  "Variables": {
    "Check.Is64": "[Eval('[System.Environment]::Is64BitOperatingSystem')]",
    "Check.WebDeploy": "[ValidateNotNull(GetPackage(Name:'Microsoft` Web` Deploy` *',ErrorAction:'Continue'))]",

    "WebDeploy.SourceUri": "[if(variable('Check.Is64'),parameter('WebDeploy64Download'),parameter('WebDeployDownload'))]",
    "WebDeploy.Download": "[JoinPath(variable('Temp.Location'),'rewrite.msi')]",

    "Temp.Location" : "[if(variable('Test.Temp.Location'),Environment('Temp'),parameter('TempLocation'))]",

    "Test.Temp.Location" : "[equal(parameter('TempLocation'),'SIF-Default')]"
  },
  "Register": {
    "ConfigFunction": {
      "Eval": "Invoke-Expression",
      "GetPackage": "Get-Package",
      "TestPath": "Test-Path"
    },
    "Tasks": {
      "RemoveItem": "Remove-Item",
      "StartProcess": "Start-Process",
      "UninstallPackage": "Uninstall-Package"
    }
  },
  "Tasks": {
    "SetupTempLocation": {
      "Type": "EnsurePath",
      "Params": {
        "Exists": ["[variable('Temp.Location')]"]
      }
    },

    "DownloadWebDeploy": {
      "Type": "DownloadFile",
      "Params": {
        "SourceUri": "[variable('WebDeploy.SourceUri')]",
        "DestinationPath": "[variable('WebDeploy.Download')]"
      },
      "Skip": "[or(variable('Check.WebDeploy'),TestPath(variable('WebDeploy.Download')))]"
    },
    "InstallWebDeploy": {
      "Type": "StartProcess",
      "Params": {
        "FilePath": "msiexec.exe",
        "ArgumentList": [
          "/i", "[variable('WebDeploy.Download')]",
          "/quiet", "/norestart"
        ],
        "Wait": true
      },
      "Skip": "[variable('Check.WebDeploy')]"
    },
    "CleanArtifacts": {
      "Type": "RemoveItem",
      "Params": {
        "LiteralPath": [
          "[variable('WebDeploy.Download')]"
        ],
        "Recurse": true,
        "ErrorAction": "SilentlyContinue"
      }
    }
  }
}