{
  "Parameters": {
    "TempLocation": {
      "Type": "string",
      "Description": "Alternative location to save downloads. If left on the default $Env:Temp will be used.",
      "DefaultValue": "SIF-Default",
      "Validate": "[TestPath(variable('Temp.Location'))]"
    },
    "DotNetSdkDownload": {
      "Type": "string",
      "Description": "Download location for .NET Framework",
      "DefaultValue": "https://download.microsoft.com/download/3/B/F/3BFB9C35-405D-45DF-BDAF-0EB57D047888/NDP472-DevPack-ENU.exe"
    }
  },
  "Variables": {
    "Check.Is64": "[Eval('[System.Environment]::Is64BitOperatingSystem')]",
    "Check.DotNetSdk": "[ValidateNotNull(GetPackage(Name:variable('DisplayName.DotNetSdk'),ErrorAction:'Continue'))]",

    "DisplayName.DotNetSdk": "Microsoft .NET Framework 4.7.2 SDK",

    "DotNetSdk.SourceUri": "[parameter('DotNetSdkDownload')]",
    "DotNetSdk.Download": "[JoinPath(variable('Temp.Location'),'NDP472-DevPack-ENU.exe')]",

    "Temp.Location" : "[if(variable('Test.Temp.Location'),Environment('Temp'),parameter('TempLocation'))]",

    "Test.Temp.Location" : "[equal(parameter('TempLocation'),'SIF-Default')]"
  },
  "Register": {
    "ConfigFunction": {
      "Eval": "Invoke-Expression",
      "GetPackage": "Get-Package",
      "TestPath": "Test-Path"
    },
    "Tasks": {
      "RemoveItem": "Remove-Item",
      "StartProcess": "Start-Process",
      "UninstallPackage": "Uninstall-Package"
    }
  },
  "Tasks": {
    "SetupTempLocation": {
      "Type": "EnsurePath",
      "Params": {
        "Exists": ["[variable('Temp.Location')]"]
      }
    },

    "DownloadDotNetSdk": {
      "Type": "DownloadFile",
      "Params": {
        "SourceUri": "[variable('DotNetSdk.SourceUri')]",
        "DestinationPath": "[variable('DotNetSdk.Download')]"
      },
      "Skip": "[or(variable('Check.DotNetSdk'),TestPath(variable('DotNetSdk.Download')))]"
    },
    "InstallDotNetSdk": {
      "Type": "StartProcess",
      "Params": {
        "FilePath": "[variable('DotNetSdk.Download')]",
        "ArgumentList": ["/q", "/norestart"],
        "Wait": true
      },
      "Skip": "[variable('Check.DotNetSdk')]"
    },
    "CleanArtifacts": {
      "Type": "RemoveItem",
      "Params": {
        "LiteralPath": [
          "[variable('DotNetSdk.Download')]"
        ],
        "Recurse": true,
        "ErrorAction": "SilentlyContinue"
      }
    }
  }
}